priority,business,website,target_channel,first_angle,status,next_action
1,Punn Impex,https://www.punnimpex.com/,South Asian grocery importer and distributor,Indian grocery and retail pouch range,Not contacted,Use official contact route and send buyer catalog
2,AMA Global Foods,https://www.amaglobalfoods.com/,Importer distributor food service,Brand introduction and western Canada distribution,Not contacted,Use official contact route and send buyer catalog
3,Morgan and Williams,https://www.morganwilliams.ca/,Specialty and ethnic grocery wholesaler,Specialty snack and multicultural grocery distribution,Not contacted,Use official contact route and send buyer catalog
4,Malik Distribution,https://www.malikdistribution.com/,South Asian and ethnic food distributor,Snack and pantry range for South Asian retail,Not contacted,Use official contact route and send buyer catalog
5,Bengal Foods,https://bengalfoods.ca/about-us/,South Asian imported food wholesaler,Makhana and Indian pantry category expansion,Not contacted,Use official contact route and send buyer catalog
6,Quality International Foods,https://qif.ca/,South Asian grocery importer distributor,Alternative makhana range and retail pack review,Not contacted,Use official contact route and send buyer catalog
7,K and K Foods,https://kandkfoods.ca/,Ethnic food importer wholesaler distributor,Indian grocery spice and snack cross sell,Not contacted,Use official contact route and send buyer catalog
8,Brothers Choice Foods,https://www.brotherschoicefoods.com/,South Asian wholesale distributor,Western Canada grocery and food service route,Not contacted,Use official contact route and send buyer catalog
